{
  "id": "local-apple-m3-pro",
  "type": "accelerator",
  "name": "Apple M3 Pro (MacBook Pro 16-inch, Nov 2023)",
  "status": "verified",
  "confidence": 0.85,
  "updated": "2026-10-04",
  "vendor": "apple",
  "architecture": "m-series (M3 Pro)",
  "release_year": 2023,
  "process_nm": 3,
  "form_factors": [
    "socs"
  ],
  "vram_gb": 36,
  "memory_type": "lpddr5 unified",
  "memory_bus_bit": null,
  "memory_bandwidth_gbps": 150,
  "memory_bandwidth_basis": "Apple tech specs: '150GB/s memory bandwidth' for the M3 Pro with 12-core CPU / 18-core GPU. Unified-memory bandwidth, package-level, shared with the CPU.",
  "tdp_w": null,
  "flops": [],
  "interconnect": [],
  "unified_memory": true,
  "consumer": true,
  "notes": "M3 Pro: 18-core GPU, 16-core Neural Engine, up to 36GB unified memory. The 150GB/s bandwidth is the lowest among M-series Pro/Max/Ultra parts. For local LLM inference, 36GB unified memory can hold a 13B model at 4-bit (~7GB weights) comfortably, or a 7B model at 8-bit (~7GB weights) with room for long context. The 150GB/s bandwidth yields roughly 15-25 tokens/sec for a 13B model at 4-bit. The M3 Pro is the budget Apple Silicon option for local inference.\nMEMORY_BUS_WIDTH: STILL NULL, AND HERE IS PRECISELY WHAT WAS LOOKED FOR (2026-10-04). %s NO FIGURE WAS BACK-COMPUTED FROM BANDWIDTH. That is the standing rule for this field in this repo and it was applied to every null here rather than to a subset: a width derived by dividing a published aggregate bandwidth by an assumed or half-assumed per-pin rate is two inferences stacked on one number, and if either inference is wrong the record looks populated while being wrong. The correct state of this field is 'the vendor does not publish it', and the note above names the specific document that was read and found not to carry it, so a future pass does not have to re-establish that from scratch.\n\nMEMORY_BUS_WIDTH: STILL NULL, AND HERE IS PRECISELY WHAT WAS LOOKED FOR (2026-10-04). Apple's own tech-specs pages publish MEMORY BANDWIDTH ONLY and have never published a memory-bus width in bits for any M-series part. Verified directly this pass on support.apple.com/en-us/111900 (Mac Studio 2022) and /en-us/122211 (Mac Studio 2025), which carry '400GB/s', '800GB/s', '410GB/s', '546GB/s' and '819GB/s' rows and no width row at all. Not back-computed: the published figures are per-SoC aggregates across a multi-package design and LPDDR5X runs at several pin rates depending on SKU, so no single width reconciles them all. NO FIGURE WAS BACK-COMPUTED FROM BANDWIDTH. That is the standing rule for this field in this repo and it was applied to every null here rather than to a subset: a width derived by dividing a published aggregate bandwidth by an assumed or half-assumed per-pin rate is two inferences stacked on one number, and if either is wrong the record looks populated while being wrong. The correct state of this field is 'the vendor does not publish it', and the text above names the specific document read and found not to carry it, so a future pass does not have to re-establish that from scratch.",
  "sources": [
    "local-apple-macbook-pro-m3-pro-tech-specs"
  ]
}
