{
  "id": "nvidia-h200-sxm",
  "type": "accelerator",
  "name": "NVIDIA H200 SXM",
  "vendor": "nvidia",
  "architecture": "hopper",
  "release_year": 2024,
  "process_nm": 4,
  "form_factors": [
    "sxm"
  ],
  "vram_gb": 141,
  "memory_type": "HBM3e",
  "memory_bus_bit": 6144,
  "memory_bandwidth_gbps": 4800,
  "memory_bandwidth_basis": "HBM3e 5.0Gbps x 6144-bit = 4,800 GB/s (NVIDIA states 4.8TB/s; 141GB = 6 stacks x 24GB on a 6,144-bit bus, which is 6 x 1024-bit = 6,144 bits).",
  "flops": [
    {
      "precision": "other",
      "tflops": 34,
      "dense": true,
      "vendor_claim": true,
      "source_id": "nv-h200-product-page",
      "notes": null
    },
    {
      "precision": "fp32",
      "tflops": 67,
      "dense": true,
      "vendor_claim": true,
      "source_id": "nv-h200-product-page"
    },
    {
      "precision": "tf32",
      "tflops": 494.5,
      "dense": true,
      "vendor_claim": true,
      "source_id": "nv-h200-product-page"
    },
    {
      "precision": "bf16",
      "tflops": 989.5,
      "dense": true,
      "vendor_claim": true,
      "source_id": "nv-h200-product-page"
    },
    {
      "precision": "fp16",
      "tflops": 989.5,
      "dense": true,
      "vendor_claim": true,
      "source_id": "nv-h200-product-page"
    },
    {
      "precision": "fp8",
      "tflops": 1979,
      "dense": true,
      "vendor_claim": true,
      "source_id": "nv-h200-product-page"
    },
    {
      "precision": "int8",
      "tflops": 1979,
      "dense": true,
      "vendor_claim": true,
      "source_id": "nv-h200-product-page"
    }
  ],
  "tdp_w": 700,
  "interconnect": [
    "nvlink-4",
    "nvswitch-4",
    "pcie-gen5"
  ],
  "unified_memory": false,
  "consumer": false,
  "status": "verified",
  "confidence": 0.85,
  "updated": "2026-10-03",
  "sources": [
    "nv-h200-product-page"
  ],
  "notes": "AUDIT VERIFIED against NVIDIA's own H200 spec table (nvidia.com/en-us/data-center/h200): the table prints FP8/INT8 3,958 TFLOPS, BF16/FP16 1,979 and TF32 989, all carrying footnote '2 With sparsity'. The dense values stored here (1,979 / 989 / 494.5) are therefore correct as dense and are now flagged dense:true. AUDIT CORRECTION: the dense/sparse flag on the tensor rows was inverted. FP16 989.5 / FP8 1979 TFLOPS are DENSE; NVIDIA prints 1,979/3,958 'With sparsity'. These rows were previously flagged dense:false, which wrongly told a reader they were sparse.  The stored numbers are correct dense values. H200 is an H100 SXM with the SAME compute (identical Tensor Core rows: 989 TF32 / 1,979 BF16+FP16 / 3,958 FP8+INT8 printed, all WITH SPARITY - dense is half) and the SAME 700W envelope, but 141GB HBM3e at 4.8TB/s instead of 80GB HBM3 at 3.35TB/s. So H200 is purely a memory-capacity and bandwidth uplift: it wins wherever KV cache or weights do not fit, and loses on nothing. That makes H200 the memory-bandwidth-per-watt inflection point of the Hopper generation. NVIDIA marks the whole table 'preliminary specifications, may be subject to change'. Bus width 6144-bit is inferred from the 141GB/4.8TB/s pair, not printed. The 'other' row is FP64 34 TFLOPS (dense) - this schema's precision enum has no fp64 member."
}
